<?xml version="1.0"?>
<!DOCTYPE Report
[
<!ELEMENT Report (General ,(Doc|BPT)) >
<!ATTLIST Report ver CDATA #REQUIRED tmZone CDATA #REQUIRED>

<!ELEMENT General ( DocLocation ) >
<!ATTLIST General productName CDATA #REQUIRED productVer CDATA #REQUIRED os CDATA #REQUIRED host CDATA #REQUIRED qcserver CDATA #IMPLIED qcproject CDATA #IMPLIED SolManSolutionId CDATA #IMPLIED SolManProjectId CDATA #IMPLIED SolManTestPlanId CDATA #IMPLIED SolManTestPackageId CDATA #IMPLIED SolManUserInfoData CDATA #IMPLIED  >

<!ELEMENT BPT (DName,Res,DVer?,TSet?,TInst?,NodeArgs,AdditionalInfo*,Doc*) >
<!ATTLIST BPT rID ID #REQUIRED >

<!ELEMENT Doc (DName,ConfName?,Res,DVer?,TSet?,TInst?,RunType?,DT?,AdditionalInfo*,Step*,DIter*,Step*,Action*,Doc*,Summary?,TestMaintenanceSummary*,NodeArgs?) >
<!ATTLIST Doc rID ID #REQUIRED type (Test|BC|BPTWrapperTest|Flow|Group|Action) "Test" productName CDATA #REQUIRED BCIter CDATA #IMPLIED >

<!ELEMENT RunType ( #PCDATA )>
<!ATTLIST RunType fmStep (False|True) "False" batch (False|True) "False" upDesc (False|True) "False" upChk (False|True) "False" upAS (False|True) "False">

<!ELEMENT DName ( #PCDATA ) >

<!ELEMENT ConfName ( #PCDATA ) >

<!ELEMENT Res ( #PCDATA ) >

<!ELEMENT AdditionalInfo (AdditionalDataName,AdditionalDataValue ) >

<!ELEMENT AdditionalDataName ( #PCDATA ) >

<!ELEMENT AdditionalDataValue ( #PCDATA ) >

<!ELEMENT DVer ( #PCDATA ) >

<!ELEMENT TSet ( #PCDATA ) >

<!ELEMENT TInst ( #PCDATA ) >

<!ELEMENT DIter (Step*,Action+,Summary?,NodeArgs)>
<!ATTLIST DIter rID ID #REQUIRED iterID CDATA #REQUIRED>

<!ELEMENT DocLocation ( #PCDATA )>

<!ELEMENT Action (AName,AIter*,(Step|HtmlStep|Action)*, Summary,ActionMaintenanceSummary*, NodeArgs ) >
<!ATTLIST Action rID ID #REQUIRED>

<!ELEMENT AIter ((Step|HtmlStep|Action)*,DataMapping?, Summary?,NodeArgs) >
<!ATTLIST AIter rID ID #REQUIRED iterID CDATA #REQUIRED isCountable (False|True) "False" >

<!ELEMENT AName ( #PCDATA ) >

<!ELEMENT TestMaintenanceSummary (ActionMaintenanceSummary*) >
<!ATTLIST TestMaintenanceSummary ObjectsAdded CDATA #REQUIRED ObjectsUpdated CDATA #REQUIRED StepsUpdated CDATA #REQUIRED StepsComments CDATA #REQUIRED><!ELEMENT ActionMaintenanceSummary (ObjectChange* ) >
<!ATTLIST ActionMaintenanceSummary Action CDATA #REQUIRED Objects CDATA #REQUIRED Updated CDATA #REQUIRED LinesTotal CDATA #REQUIRED Added CDATA #REQUIRED LinesUpdated CDATA #REQUIRED>

<!ELEMENT ObjectChange  (Hierarchy, PropertyChangeList* ) >
<!ATTLIST ObjectChange Operation CDATA #IMPLIED OriginalRepository CDATA #IMPLIED>

<!ELEMENT PropertyChangeList (PropertyDef*) >

<!ELEMENT PropertyDef (OriginalValue, NewValue) >
<!ATTLIST PropertyDef PropName CDATA #REQUIRED OriginRegularExpression (True|False) "False" NewRegularExpression (True|False) "False" AddedProperty (True|False) "False" >

<!ELEMENT OriginalValue ( #PCDATA )>

<!ELEMENT NewValue ( #PCDATA )>

<!ELEMENT Hierarchy  (ObjectName, Hierarchy*) >
<!ATTLIST Hierarchy MicClass CDATA #REQUIRED>

<!ELEMENT ObjectName  ( #PCDATA ) >

<!ELEMENT Step (Obj,Details,Time,TimeTick* ,(Step|HtmlStep|Doc)*, DataMapping?, NodeArgs) >
<!ATTLIST Step rID ID #REQUIRED retval CDATA #IMPLIED>

<!ELEMENT HtmlStep (HTML,TimeTick*,(Step|HtmlStep|Doc)*,NodeArgs) >
<!ATTLIST HtmlStep rID ID #REQUIRED >

<!ELEMENT Obj ( #PCDATA ) >
<!ATTLIST Obj plainTxt (False|True) "True">

<!ELEMENT Details ( #PCDATA ) >
<!ATTLIST Details plainTxt (False|True) "True">

<!ELEMENT Time ( #PCDATA ) >

<!ELEMENT HTML ( #PCDATA ) >

<!ELEMENT Disp ( #PCDATA ) >

<!ELEMENT TimeTick ( #PCDATA ) >

<!ELEMENT DataMapping ( DataMappedItem* )>
<!ELEMENT DataMappedItem EMPTY >
<!ATTLIST DataMappedItem dsName CDATA #REQUIRED >
<!ATTLIST DataMappedItem rowId CDATA #REQUIRED >

<!ELEMENT NodeArgs (Disp,TopPane?,BtmPane?,ExtendedInfo? )>
<!ATTLIST NodeArgs eType CDATA #REQUIRED icon CDATA #REQUIRED nRep CDATA #REQUIRED UserNote CDATA #IMPLIED filter (False|True) "True">
<!ATTLIST NodeArgs status (Passed|Failed|Done|Warning|Information) "Done">
<!ATTLIST NodeArgs iconSel CDATA #IMPLIED nType CDATA #IMPLIED MovieMarker CDATA "">
<!ATTLIST NodeArgs Source CDATA #IMPLIED SourceLine CDATA #IMPLIED StepFlowItemKey CDATA #IMPLIED >

<!ELEMENT TopPane (Path)>

<!ELEMENT BtmPane ( (Path|WR)?,ASHilite?)>
<!ATTLIST BtmPane vType CDATA "HTML">

<!ELEMENT Path ( #PCDATA ) >

<!ELEMENT ASHilite ( #PCDATA ) >

<!ELEMENT WR ( #PCDATA ) >

<!ELEMENT ExtendedInfo ( StepData ) >

<!ATTLIST ExtendedInfo StepType CDATA #REQUIRED>
<!ELEMENT DT (NodeArgs) >
<!ATTLIST DT rID ID #REQUIRED>

<!ELEMENT Summary (Param*)>
<!ATTLIST Summary sTime CDATA #IMPLIED eTime CDATA #IMPLIED passed CDATA #IMPLIED failed CDATA #IMPLIED warnings CDATA #IMPLIED retval CDATA #IMPLIED stopped (False|True) "False" >

<!ELEMENT Param (ParamName,ParamVal)+ >
<!ATTLIST Param paramInOut (In|Out) "In">

<!ELEMENT ParamName ( #PCDATA ) >

<!ELEMENT ParamVal ( #PCDATA ) >

]
>
<Report ver="2.0" tmZone="India Standard Time">
<General productName="Micro Focus Unified Functional Testing" productVer="14.50" os="" host="INLEN8520068267"><DocLocation><![CDATA[C:\UFT Framework\QTP-Hybrid-Framework\TestCases\OrangeHRM_framework]]></DocLocation></General>
<Doc rID="T1"   productName= "Micro Focus Unified Functional Testing"  >
<DName><![CDATA[OrangeHRM_framework]]></DName>
<Res><![CDATA[Res38]]></Res>
<DT rID="T2">
<NodeArgs eType="Table" icon="2" nRep="4" filter="False" >
<Disp><![CDATA[Run-Time Data Table]]></Disp>
<BtmPane vType="Table" >
<Path><![CDATA[Default.xls]]></Path>
</BtmPane>
</NodeArgs>
</DT>
<DIter rID="T3" iterID="1" >
<Action rID="T4">
<AName><![CDATA[Login]]></AName>
<Step rID="T5">
<Obj plainTxt="False" ><![CDATA[[ username ].Set]]></Obj>
<Details plainTxt="False" ><![CDATA["Admin"]]></Details>
<Time><![CDATA[14-02-2023 - 21:21:52]]></Time>
<TimeTick>1676389912</TimeTick>
<NodeArgs eType="Replay" icon="5" nRep="11" Source="Login" SourceLine="1" >
<Disp><![CDATA[[ username ].Set]]></Disp>
</NodeArgs>
</Step>
<Step rID="T6">
<Obj plainTxt="False" ><![CDATA[[ password ].Set]]></Obj>
<Details plainTxt="False" ><![CDATA["63eb984214495f7dae03e1e0a08164ab5dee11ed7412"]]></Details>
<Time><![CDATA[14-02-2023 - 21:21:52]]></Time>
<TimeTick>1676389912</TimeTick>
<NodeArgs eType="Replay" icon="5" nRep="14" Source="Login" SourceLine="2" >
<Disp><![CDATA[[ password ].Set]]></Disp>
</NodeArgs>
</Step>
<Step rID="T7">
<Obj plainTxt="False" ><![CDATA[[  Login  ].Click]]></Obj>
<Details plainTxt="False" ><![CDATA[]]></Details>
<Time><![CDATA[14-02-2023 - 21:21:52]]></Time>
<TimeTick>1676389912</TimeTick>
<NodeArgs eType="Replay" icon="6" nRep="17" Source="Login" SourceLine="3" >
<Disp><![CDATA[[  Login  ].Click]]></Disp>
</NodeArgs>
</Step>
<Summary sTime="14-02-2023 - 21:21:52" eTime="14-02-2023 - 21:21:52" passed="0" failed="0" warnings="0" ></Summary>
<NodeArgs eType="StartAction" icon="4" nRep="8" >
<Disp><![CDATA[Login Summary]]></Disp>
</NodeArgs>
</Action>
<Action rID="T8">
<AName><![CDATA[Search]]></AName>
<Step rID="T9">
<Obj plainTxt="False" ><![CDATA[[ PIM ].Click]]></Obj>
<Details plainTxt="False" ><![CDATA[]]></Details>
<Time><![CDATA[14-02-2023 - 21:21:54]]></Time>
<TimeTick>1676389914</TimeTick>
<NodeArgs eType="Replay" icon="7" nRep="22" Source="Search" SourceLine="1" >
<Disp><![CDATA[[ PIM ].Click]]></Disp>
</NodeArgs>
</Step>
<Step rID="T10">
<Obj plainTxt="False" ><![CDATA[[ WebEdit ].Set]]></Obj>
<Details plainTxt="False" ><![CDATA["0007"]]></Details>
<Time><![CDATA[14-02-2023 - 21:21:56]]></Time>
<TimeTick>1676389916</TimeTick>
<NodeArgs eType="Replay" icon="5" nRep="25" Source="Search" SourceLine="2" >
<Disp><![CDATA[[ WebEdit ].Set]]></Disp>
</NodeArgs>
</Step>
<Step rID="T11">
<Obj plainTxt="False" ><![CDATA[[  Search  ].Click]]></Obj>
<Details plainTxt="False" ><![CDATA[]]></Details>
<Time><![CDATA[14-02-2023 - 21:21:56]]></Time>
<TimeTick>1676389916</TimeTick>
<NodeArgs eType="Replay" icon="6" nRep="28" Source="Search" SourceLine="3" >
<Disp><![CDATA[[  Search  ].Click]]></Disp>
</NodeArgs>
</Step>
<Step rID="T12">
<Obj plainTxt="False" ><![CDATA[[  Reset  ].Click]]></Obj>
<Details plainTxt="False" ><![CDATA[]]></Details>
<Time><![CDATA[14-02-2023 - 21:21:56]]></Time>
<TimeTick>1676389916</TimeTick>
<NodeArgs eType="Replay" icon="6" nRep="31" Source="Search" SourceLine="4" >
<Disp><![CDATA[[  Reset  ].Click]]></Disp>
</NodeArgs>
</Step>
<Summary sTime="14-02-2023 - 21:21:53" eTime="14-02-2023 - 21:21:56" passed="0" failed="0" warnings="0" ></Summary>
<NodeArgs eType="StartAction" icon="4" nRep="19" >
<Disp><![CDATA[Search Summary]]></Disp>
</NodeArgs>
</Action>
<Action rID="T13">
<AName><![CDATA[Add]]></AName>
<Step rID="T14">
<Obj plainTxt="False" ><![CDATA[[  Add  ].Click]]></Obj>
<Details plainTxt="False" ><![CDATA[]]></Details>
<Time><![CDATA[14-02-2023 - 21:21:56]]></Time>
<TimeTick>1676389916</TimeTick>
<NodeArgs eType="Replay" icon="6" nRep="36" Source="Add" SourceLine="1" >
<Disp><![CDATA[[  Add  ].Click]]></Disp>
</NodeArgs>
</Step>
<Step rID="T15">
<Obj plainTxt="False" ><![CDATA[[ firstName ].Set]]></Obj>
<Details plainTxt="False" ><![CDATA["John"]]></Details>
<Time><![CDATA[14-02-2023 - 21:21:58]]></Time>
<TimeTick>1676389918</TimeTick>
<NodeArgs eType="Replay" icon="5" nRep="40" Source="Add" SourceLine="2" >
<Disp><![CDATA[[ firstName ].Set]]></Disp>
</NodeArgs>
</Step>
<Step rID="T16">
<Obj plainTxt="False" ><![CDATA[[ lastName ].Set]]></Obj>
<Details plainTxt="False" ><![CDATA["Smith"]]></Details>
<Time><![CDATA[14-02-2023 - 21:21:58]]></Time>
<TimeTick>1676389918</TimeTick>
<NodeArgs eType="Replay" icon="5" nRep="43" Source="Add" SourceLine="3" >
<Disp><![CDATA[[ lastName ].Set]]></Disp>
</NodeArgs>
</Step>
<Step rID="T17">
<Obj plainTxt="False" ><![CDATA[Run Error]]></Obj>
<Details plainTxt="False" ><![CDATA[The &quot;Save&quot;  object was not found in the Object Repository.<BR/>Check the Object Repository to confirm that the object exists or to find the correct name for the object.<BR/>Line (5): &quot;Browser(&quot;name:=OrangeHRM&quot;).Page(&quot;title:=OrangeHRM&quot;).WebButton(&quot;Save&quot;).Click&quot;. ]]></Details>
<Time><![CDATA[14-02-2023 - 21:21:58]]></Time>
<TimeTick>1676389918</TimeTick>
<NodeArgs eType="Replay" icon="8" nRep="44" status="Failed" Source="Add" SourceLine="4" >
<Disp><![CDATA[Run Error]]></Disp>
</NodeArgs>
</Step>
<Step rID="T18">
<Obj plainTxt="False" ><![CDATA[Stop Run]]></Obj>
<Details plainTxt="False" ><![CDATA[Run stopped by user.]]></Details>
<Time><![CDATA[14-02-2023 - 21:22:27]]></Time>
<TimeTick>1676389947</TimeTick>
<NodeArgs eType="General" icon="9" nRep="45" status="Information" >
<Disp><![CDATA[Stop Run]]></Disp>
</NodeArgs>
</Step>
<Summary sTime="14-02-2023 - 21:21:56" eTime="14-02-2023 - 21:22:27" passed="0" failed="1" warnings="0" ></Summary>
<NodeArgs eType="StartAction" icon="4" nRep="33" status="Failed" >
<Disp><![CDATA[Add Summary]]></Disp>
</NodeArgs>
</Action>
<NodeArgs eType="StartIteration" icon="3" nRep="6" status="Failed" >
<Disp><![CDATA[OrangeHRM_framework Iteration 1 (Row 1)]]></Disp>
</NodeArgs>
</DIter>
<Summary sTime="14-02-2023 - 21:21:49" eTime="14-02-2023 - 21:22:27" passed="0" failed="1" warnings="0" ></Summary>
<NodeArgs eType="StartTest" icon="1" nRep="3" status="Failed" >
<Disp><![CDATA[Test OrangeHRM_framework Summary]]></Disp>
</NodeArgs>
</Doc>
</Report>